,CBSA,MNAME,Year,TOT_POP,UBER_ARRIVAL,TNC_ARRIVAL_YEAR,TNC_FIRST_FULL_YEAR_OPERATION,TNC_FLAG,APTA_CLUSTER,Proposed TNC Groups
296,42700,"Sebring, FL Metro Area",2017,102883,10/1/18,2018,2019,0,,
297,43100,"Sheboygan, WI Metro Area",2017,115344,5/1/17,2017,2018,0,Low Op-Ex,22
298,43300,"Sherman-Denison, TX Metro Area",2017,131140,6/1/18,2018,2019,0,Low Op-Ex,22
299,43340,"Shreveport-Bossier City, LA Metro Area",2017,440933,2/1/18,2018,2019,0,Low Op-Ex,22
300,43420,"Sierra Vista-Douglas, AZ Metro Area",2017,124756,6/1/18,2018,2019,0,,
301,43580,"Sioux City, IA-NE-SD Metro Area",2017,169131,4/1/17,2017,2018,0,Low Op-Ex,22
302,43780,"South Bend-Mishawaka, IN-MI Metro Area",2017,321815,10/1/14,2014,2015,1,Low Op-Ex,22
303,43900,"Spartanburg, SC Metro Area",2017,334391,7/1/15,2015,2016,1,Low Op-Ex,22
304,45940,"Trenton, NJ Metro Area",2017,374733,5/1/14,2014,2015,1,Mid Op-Ex,21
305,44100,"Springfield, IL Metro Area",2017,207596,2/1/15,2015,2016,1,Low Op-Ex,22
306,11460,"Ann Arbor, MI Metro Area",2017,367627,4/1/14,2014,2015,1,Mid Op-Ex,21
307,44180,"Springfield, MO Metro Area",2017,461469,11/1/16,2016,2017,1,Low Op-Ex,22
308,44220,"Springfield, OH Metro Area",2017,134557,2/1/17,2017,2018,0,Low Op-Ex,22
309,44300,"State College, PA Metro Area",2017,162660,2/1/15,2015,2016,1,Low Op-Ex,22
310,44420,"Staunton-Waynesboro, VA Metro Area",2017,121999,3/1/18,2018,2019,0,,
311,14500,"Boulder, CO Metro Area",2017,322514,2/1/14,2014,2015,1,Mid Op-Ex,21
312,44940,"Sumter, SC Metro Area",2017,106847,3/1/18,2018,2019,0,Low Op-Ex,22
313,28420,"Kennewick-Richland, WA Metro Area",2017,290296,12/1/16,2016,2017,1,Mid Op-Ex,21
314,45220,"Tallahassee, FL Metro Area",2017,385473,9/1/14,2014,2015,1,Low Op-Ex,22
315,36500,"Olympia-Tumwater, WA Metro Area",2017,280588,6/1/15,2015,2016,1,Mid Op-Ex,21
316,45460,"Terre Haute, IN Metro Area",2017,165798,3/1/17,2017,2018,0,Low Op-Ex,22
317,45500,"Texarkana, TX-AR Metro Area",2017,152188,4/1/18,2018,2019,0,Low Op-Ex,22
318,45540,"The Villages, FL Metro Area",2017,125165,12/1/17,2017,2018,0,,
319,45780,"Toledo, OH Metro Area",2017,603668,11/1/14,2014,2015,1,Low Op-Ex,22
320,45820,"Topeka, KS Metro Area",2017,233149,11/1/15,2015,2016,1,Low Op-Ex,22
321,42100,"Santa Cruz-Watsonville, CA Metro Area",2017,275897,6/1/14,2014,2015,1,Mid Op-Ex,21
322,12100,"Atlantic City-Hammonton, NJ Metro Area",2017,269918,5/1/14,2014,2015,1,Mid Op-Ex,21
323,46140,"Tulsa, OK Metro Area",2017,990773,4/1/14,2014,2015,1,Low Op-Ex,22
324,46220,"Tuscaloosa, AL Metro Area",2017,242279,8/1/16,2016,2017,1,Low Op-Ex,22
325,46340,"Tyler, TX Metro Area",2017,227727,9/1/16,2016,2017,1,Low Op-Ex,22
326,14740,"Bremerton-Silverdale, WA Metro Area",2017,266414,5/1/16,2016,2017,1,Mid Op-Ex,21
327,46540,"Utica-Rome, NY Metro Area",2017,293572,7/1/17,2017,2018,0,Low Op-Ex,22
328,46660,"Valdosta, GA Metro Area",2017,145871,3/1/17,2017,2018,0,,
329,46700,"Vallejo-Fairfield, CA Metro Area",2017,445458,11/1/14,2014,2015,1,Low Op-Ex,22
330,47020,"Victoria, TX Metro Area",2017,100228,3/1/18,2018,2019,0,Low Op-Ex,22
331,47220,"Vineland-Bridgeton, NJ Metro Area",2017,152538,10/1/16,2016,2017,1,Low Op-Ex,22
332,16580,"Champaign-Urbana, IL Metro Area",2017,241000,2/1/15,2015,2016,1,Mid Op-Ex,21
333,47300,"Visalia-Porterville, CA Metro Area",2017,464493,6/1/15,2015,2016,1,Low Op-Ex,22
334,47380,"Waco, TX Metro Area",2017,267554,1/1/15,2015,2016,1,Low Op-Ex,22
335,47460,"Walla Walla, WA Metro Area",2017,64831,8/1/18,2018,2019,0,,
336,47580,"Warner Robins, GA Metro Area",2017,192766,6/1/16,2016,2017,1,Low Op-Ex,22
337,47900,"Washington-Arlington-Alexandria, DC-VA-MD-WV Metro Area",2017,6216710,12/1/11,2011,2012,1,High Op-Ex,3
338,47940,"Waterloo-Cedar Falls, IA Metro Area",2017,169892,4/1/17,2017,2018,0,Low Op-Ex,22
339,48060,"Watertown-Fort Drum, NY Metro Area",2017,114187,7/1/17,2017,2018,0,,
340,48140,"Wausau, WI Metro Area",2017,135732,3/1/17,2017,2018,0,Low Op-Ex,22
341,48300,"Wenatchee, WA Metro Area",2017,118478,6/1/17,2017,2018,0,Low Op-Ex,22
342,48540,"Wheeling, WV-OH Metro Area",2017,141254,9/1/17,2017,2018,0,Low Op-Ex,22
343,48620,"Wichita, KS Metro Area",2017,646542,9/1/14,2014,2015,1,Low Op-Ex,22
344,48660,"Wichita Falls, TX Metro Area",2017,151230,8/1/17,2017,2018,0,Low Op-Ex,22
345,48700,"Williamsport, PA Metro Area",2017,113841,11/1/16,2016,2017,1,Low Op-Ex,22
346,48900,"Wilmington, NC Metro Area",2017,288156,7/1/14,2014,2015,1,Low Op-Ex,22
347,49020,"Winchester, VA-WV Metro Area",2017,139223,9/1/16,2016,2017,1,Low Op-Ex,22
348,49180,"Winston-Salem, NC Metro Area",2017,667733,8/1/14,2014,2015,1,Low Op-Ex,22
349,12700,"Barnstable Town, MA Metro Area",2017,213444,5/1/15,2015,2016,1,Mid Op-Ex,21
350,49420,"Yakima, WA Metro Area",2017,250193,12/1/16,2016,2017,1,Low Op-Ex,22
351,49620,"York-Hanover, PA Metro Area",2017,446078,7/1/15,2015,2016,1,Low Op-Ex,22
352,49660,"Youngstown-Warren-Boardman, OH-PA Metro Area",2017,541926,6/1/16,2016,2017,1,Low Op-Ex,22
353,49700,"Yuba City, CA Metro Area",2017,173679,4/1/16,2016,2017,1,Low Op-Ex,22
354,49740,"Yuma, AZ Metro Area",2017,207534,3/1/16,2016,2017,1,Low Op-Ex,22