,CBSA,MNAME,Year,TOT_POP,UBER_ARRIVAL,TNC_ARRIVAL_YEAR,TNC_FIRST_FULL_YEAR_OPERATION,TNC_FLAG,APTA_CLUSTER,Proposed TNC Groups
321,42100,"Santa Cruz-Watsonville, CA Metro Area",2017,275897,6/1/14,2014,2015,1,Mid Op-Ex,21.0
322,12100,"Atlantic City-Hammonton, NJ Metro Area",2017,269918,5/1/14,2014,2015,1,Mid Op-Ex,21.0
323,46140,"Tulsa, OK Metro Area",2017,990773,4/1/14,2014,2015,1,Low Op-Ex,22.0
324,46220,"Tuscaloosa, AL Metro Area",2017,242279,8/1/16,2016,2017,1,Low Op-Ex,22.0
325,46340,"Tyler, TX Metro Area",2017,227727,9/1/16,2016,2017,1,Low Op-Ex,22.0
326,14740,"Bremerton-Silverdale, WA Metro Area",2017,266414,5/1/16,2016,2017,1,Mid Op-Ex,21.0
327,46540,"Utica-Rome, NY Metro Area",2017,293572,7/1/17,2017,2018,0,Low Op-Ex,22.0
328,46660,"Valdosta, GA Metro Area",2017,145871,3/1/17,2017,2018,0,,
329,46700,"Vallejo-Fairfield, CA Metro Area",2017,445458,11/1/14,2014,2015,1,Low Op-Ex,22.0
331,47220,"Vineland-Bridgeton, NJ Metro Area",2017,152538,10/1/16,2016,2017,1,Low Op-Ex,22.0
332,16580,"Champaign-Urbana, IL Metro Area",2017,241000,2/1/15,2015,2016,1,Mid Op-Ex,21.0
333,47300,"Visalia-Porterville, CA Metro Area",2017,464493,6/1/15,2015,2016,1,Low Op-Ex,22.0
334,47380,"Waco, TX Metro Area",2017,267554,1/1/15,2015,2016,1,Low Op-Ex,22.0
336,47580,"Warner Robins, GA Metro Area",2017,192766,6/1/16,2016,2017,1,Low Op-Ex,22.0
337,47900,"Washington-Arlington-Alexandria, DC-VA-MD-WV Metro Area",2017,6216710,12/1/11,2011,2012,1,High Op-Ex,3.0
338,47940,"Waterloo-Cedar Falls, IA Metro Area",2017,169892,4/1/17,2017,2018,0,Low Op-Ex,22.0
339,48060,"Watertown-Fort Drum, NY Metro Area",2017,114187,7/1/17,2017,2018,0,,
340,48140,"Wausau, WI Metro Area",2017,135732,3/1/17,2017,2018,0,Low Op-Ex,22.0
341,48300,"Wenatchee, WA Metro Area",2017,118478,6/1/17,2017,2018,0,Low Op-Ex,22.0
342,48540,"Wheeling, WV-OH Metro Area",2017,141254,9/1/17,2017,2018,0,Low Op-Ex,22.0
343,48620,"Wichita, KS Metro Area",2017,646542,9/1/14,2014,2015,1,Low Op-Ex,22.0
344,48660,"Wichita Falls, TX Metro Area",2017,151230,8/1/17,2017,2018,0,Low Op-Ex,22.0
345,48700,"Williamsport, PA Metro Area",2017,113841,11/1/16,2016,2017,1,Low Op-Ex,22.0
346,48900,"Wilmington, NC Metro Area",2017,288156,7/1/14,2014,2015,1,Low Op-Ex,22.0
347,49020,"Winchester, VA-WV Metro Area",2017,139223,9/1/16,2016,2017,1,Low Op-Ex,22.0
348,49180,"Winston-Salem, NC Metro Area",2017,667733,8/1/14,2014,2015,1,Low Op-Ex,22.0
349,12700,"Barnstable Town, MA Metro Area",2017,213444,5/1/15,2015,2016,1,Mid Op-Ex,21.0
350,49420,"Yakima, WA Metro Area",2017,250193,12/1/16,2016,2017,1,Low Op-Ex,22.0
351,49620,"York-Hanover, PA Metro Area",2017,446078,7/1/15,2015,2016,1,Low Op-Ex,22.0
352,49660,"Youngstown-Warren-Boardman, OH-PA Metro Area",2017,541926,6/1/16,2016,2017,1,Low Op-Ex,22.0
353,49700,"Yuba City, CA Metro Area",2017,173679,4/1/16,2016,2017,1,Low Op-Ex,22.0
354,49740,"Yuma, AZ Metro Area",2017,207534,3/1/16,2016,2017,1,Low Op-Ex,22.0
