,CBSA,MNAME,Year,TOT_POP,UBER_ARRIVAL,TNC_ARRIVAL_YEAR,TNC_FIRST_FULL_YEAR_OPERATION,TNC_FLAG,APTA_CLUSTER,Proposed TNC Groups
0,10180,"Abilene, TX Metro Area",2017,169747,10/1/15,2015,2016,1,Low Op-Ex,22.0
1,40140,"Riverside-San Bernardino-Ontario, CA Metro Area",2017,4580670,2/1/14,2014,2015,1,Mid Op-Ex,21.0
2,10500,"Albany, GA Metro Area",2017,151754,5/1/17,2017,2018,0,Low Op-Ex,22.0
4,19820,"Detroit-Warren-Dearborn, MI Metro Area",2017,4313002,3/1/13,2013,2014,1,Mid Op-Ex,21.0
5,45300,"Tampa-St. Petersburg-Clearwater, FL Metro Area",2017,3091399,4/1/14,2014,2015,1,Mid Op-Ex,21.0
6,41180,"St. Louis, MO-IL Metro Area",2017,2807216,11/1/14,2014,2015,1,Mid Op-Ex,21.0
7,11020,"Altoona, PA Metro Area",2017,123457,8/1/16,2016,2017,1,Low Op-Ex,22.0
8,11100,"Amarillo, TX Metro Area",2017,266575,5/1/15,2015,2016,1,Low Op-Ex,22.0
9,11180,"Ames, IA Metro Area",2017,97502,8/1/15,2015,2016,1,Low Op-Ex,22.0
10,16740,"Charlotte-Concord-Gastonia, NC-SC Metro Area",2017,2525305,9/1/13,2013,2014,1,Mid Op-Ex,21.0
11,36740,"Orlando-Kissimmee-Sanford, FL Metro Area",2017,2509831,6/1/14,2014,2015,1,Mid Op-Ex,21.0
12,11540,"Appleton, WI Metro Area",2017,236126,9/1/15,2015,2016,1,,
13,11700,"Asheville, NC Metro Area",2017,456145,8/1/14,2014,2015,1,Low Op-Ex,22.0
14,12020,"Athens-Clarke County, GA Metro Area",2017,206937,8/1/14,2014,2015,1,Low Op-Ex,22.0
15,12060,"Atlanta-Sandy Springs-Roswell, GA Metro Area",2017,5882450,8/1/12,2012,2013,1,High Op-Ex,14.0
16,41700,"San Antonio-New Braunfels, TX Metro Area",2017,2473974,4/1/14,2014,2015,1,Mid Op-Ex,21.0
17,12220,"Auburn-Opelika, AL Metro Area",2017,161604,8/1/16,2016,2017,1,Low Op-Ex,22.0
18,12260,"Augusta-Richmond County, GA-SC Metro Area",2017,600600,4/1/15,2015,2016,1,Low Op-Ex,22.0
19,40900,"Sacramento-Roseville-Arden-Arcade, CA Metro Area",2017,2324884,2/1/13,2013,2014,1,Mid Op-Ex,21.0
20,12540,"Bakersfield, CA Metro Area",2017,893119,6/1/14,2014,2015,1,,
21,12580,"Baltimore-Columbia-Towson, MD Metro Area",2017,2808175,1/1/13,2013,2014,1,High Op-Ex,15.0
22,12620,"Bangor, ME Metro Area",2017,151957,10/1/15,2015,2016,1,Low Op-Ex,22.0
23,29820,"Las Vegas-Henderson-Paradise, NV Metro Area",2017,2204079,9/1/15,2015,2016,1,Mid Op-Ex,21.0
24,12940,"Baton Rouge, LA Metro Area",2017,834159,7/1/14,2014,2015,1,Low Op-Ex,22.0
26,13140,"Beaumont-Port Arthur, TX Metro Area",2017,411339,2/1/16,2016,2017,1,Low Op-Ex,22.0
28,13380,"Bellingham, WA Metro Area",2017,221404,11/1/15,2015,2016,1,Low Op-Ex,22.0
29,13460,"Bend-Redmond, OR Metro Area",2017,186875,5/1/17,2017,2018,0,Low Op-Ex,22.0
30,13740,"Billings, MT Metro Area",2017,172081,8/1/16,2016,2017,1,Low Op-Ex,22.0
31,13780,"Binghamton, NY Metro Area",2017,242217,7/1/17,2017,2018,0,Low Op-Ex,22.0
32,17140,"Cincinnati, OH-KY-IN Metro Area",2017,2180746,3/1/14,2014,2015,1,Mid Op-Ex,21.0
33,13900,"Bismarck, ND Metro Area",2017,132767,3/1/17,2017,2018,0,Low Op-Ex,22.0
34,13980,"Blacksburg-Christiansburg-Radford, VA Metro Area",2017,181986,10/1/14,2014,2015,1,Low Op-Ex,22.0
35,14020,"Bloomington, IN Metro Area",2017,167825,8/1/14,2014,2015,1,Low Op-Ex,22.0
36,14060,"Bloomington, IL Metro Area",2017,186356,3/1/15,2015,2016,1,Low Op-Ex,22.0
38,14260,"Boise City, ID Metro Area",2017,710323,11/1/14,2014,2015,1,Low Op-Ex,22.0
39,14460,"Boston-Cambridge-Newton, MA-NH Metro Area",2017,4836531,10/1/11,2011,2012,1,High Op-Ex,5.0
40,28140,"Kansas City, MO-KS Metro Area",2017,2126945,5/1/14,2014,2015,1,Mid Op-Ex,21.0
41,14540,"Bowling Green, KY Metro Area",2017,178474,9/1/15,2015,2016,1,Low Op-Ex,22.0
42,12420,"Austin-Round Rock, TX Metro Area",2017,2115827,6/1/14,2014,2015,1,Mid Op-Ex,21.0
43,18140,"Columbus, OH Metro Area",2017,2078725,12/1/13,2013,2014,1,Mid Op-Ex,21.0
44,15180,"Brownsville-Harlingen, TX Metro Area",2017,423725,7/1/17,2017,2018,0,Low Op-Ex,22.0
45,15260,"Brunswick, GA Metro Area",2017,114473,3/1/16,2016,2017,1,,
46,17460,"Cleveland-Elyria, OH Metro Area",2017,2058844,4/1/14,2014,2015,1,Mid Op-Ex,21.0
47,15500,"Burlington, NC Metro Area",2017,162391,8/1/15,2015,2016,1,Low Op-Ex,22.0
48,15540,"Burlington-South Burlington, VT Metro Area",2017,218341,11/1/14,2014,2015,1,Low Op-Ex,22.0
49,15680,"California-Lexington Park, MD Metro Area",2017,112667,6/1/16,2016,2017,1,,
50,15940,"Canton-Massillon, OH Metro Area",2017,399927,5/1/15,2015,2016,1,Low Op-Ex,22.0
51,15980,"Cape Coral-Fort Myers, FL Metro Area",2017,739224,12/1/14,2014,2015,1,Low Op-Ex,22.0
52,16060,"Carbondale-Marion, IL Metro Area",2017,125612,4/1/17,2017,2018,0,,
53,16180,"Carson City, NV Metro Area",2017,54745,8/1/16,2016,2017,1,Low Op-Ex,22.0
54,16220,"Casper, WY Metro Area",2017,79547,3/1/17,2017,2018,0,Low Op-Ex,22.0
55,16300,"Cedar Rapids, IA Metro Area",2017,270293,1/1/15,2015,2016,1,Low Op-Ex,22.0
56,16540,"Chambersburg-Waynesboro, PA Metro Area",2017,154234,10/1/17,2017,2018,0,,
57,26900,"Indianapolis-Carmel-Anderson, IN Metro Area",2017,2027059,6/1/13,2013,2014,1,Mid Op-Ex,21.0
58,16620,"Charleston, WV Metro Area",2017,215089,7/1/16,2016,2017,1,Low Op-Ex,22.0
59,16700,"Charleston-North Charleston, SC Metro Area",2017,775831,7/1/14,2014,2015,1,Low Op-Ex,22.0
60,34980,"Nashville-Davidson-Murfreesboro-Franklin, TN Metro Area",2017,1904226,12/1/13,2013,2014,1,Mid Op-Ex,21.0
61,16820,"Charlottesville, VA Metro Area",2017,232182,9/1/14,2014,2015,1,Low Op-Ex,22.0
62,16860,"Chattanooga, TN-GA Metro Area",2017,554876,11/1/14,2014,2015,1,Low Op-Ex,22.0
63,16940,"Cheyenne, WY Metro Area",2017,98327,3/1/17,2017,2018,0,Low Op-Ex,22.0
64,16980,"Chicago-Naperville-Elgin, IL-IN-WI Metro Area",2017,9533895,9/1/11,2011,2012,1,High Op-Ex,4.0
65,17020,"Chico, CA Metro Area",2017,229294,10/1/15,2015,2016,1,Low Op-Ex,22.0
66,47260,"Virginia Beach-Norfolk-Newport News, VA-NC Metro Area",2017,1724388,5/1/14,2014,2015,1,Mid Op-Ex,21.0
67,17300,"Clarksville, TN-KY Metro Area",2017,285602,3/1/16,2016,2017,1,Low Op-Ex,22.0
68,17420,"Cleveland, TN Metro Area",2017,123935,9/1/17,2017,2018,0,Low Op-Ex,22.0
69,39300,"Providence-Warwick, RI-MA Metro Area",2017,1621122,11/1/13,2013,2014,1,Mid Op-Ex,21.0
70,17660,"Coeur d'Alene, ID Metro Area",2017,157637,3/1/16,2016,2017,1,Low Op-Ex,22.0
71,17780,"College Station-Bryan, TX Metro Area",2017,258860,10/1/14,2014,2015,1,Low Op-Ex,22.0
72,17820,"Colorado Springs, CO Metro Area",2017,723878,5/1/14,2014,2015,1,Low Op-Ex,22.0
73,17860,"Columbia, MO Metro Area",2017,178271,3/1/15,2015,2016,1,Low Op-Ex,22.0
74,17900,"Columbia, SC Metro Area",2017,825004,7/1/14,2014,2015,1,Low Op-Ex,22.0
75,17980,"Columbus, GA-AL Metro Area",2017,305911,9/1/16,2016,2017,1,Low Op-Ex,22.0
77,33340,"Milwaukee-Waukesha-West Allis, WI Metro Area",2017,1576236,3/1/14,2014,2015,1,Mid Op-Ex,21.0
78,27260,"Jacksonville, FL Metro Area",2017,1504980,1/1/14,2014,2015,1,Mid Op-Ex,21.0
79,18700,"Corvallis, OR Metro Area",2017,90951,9/1/17,2017,2018,0,Low Op-Ex,22.0
80,19100,"Dallas-Fort Worth-Arlington, TX Metro Area",2017,7400479,8/1/12,2012,2013,1,High Op-Ex,17.0
81,19300,"Daphne-Fairhope-Foley, AL Metro Area",2017,212628,10/1/16,2016,2017,1,,
82,19340,"Davenport-Moline-Rock Island, IA-IL Metro Area",2017,382298,7/1/15,2015,2016,1,Low Op-Ex,22.0
83,36420,"Oklahoma City, OK Metro Area",2017,1383737,11/1/13,2013,2014,1,Mid Op-Ex,21.0
84,19500,"Decatur, IL Metro Area",2017,105801,3/1/17,2017,2018,0,Low Op-Ex,22.0
85,32820,"Memphis, TN-MS-AR Metro Area",2017,1346626,5/1/14,2014,2015,1,Mid Op-Ex,21.0
86,19740,"Denver-Aurora-Lakewood, CO Metro Area",2017,2888227,8/1/12,2012,2013,1,High Op-Ex,19.0
87,19780,"Des Moines-West Des Moines, IA Metro Area",2017,645911,9/1/14,2014,2015,1,Low Op-Ex,22.0
88,39580,"Raleigh, NC Metro Area",2017,1335079,4/1/14,2014,2015,1,Mid Op-Ex,21.0
90,20100,"Dover, DE Metro Area",2017,176824,8/1/15,2015,2016,1,Low Op-Ex,22.0
91,20220,"Dubuque, IA Metro Area",2017,97041,4/1/17,2017,2018,0,Low Op-Ex,22.0
92,20260,"Duluth, MN-WI Metro Area",2017,278782,5/1/17,2017,2018,0,Low Op-Ex,22.0
93,40060,"Richmond, VA Metro Area",2017,1301540,8/1/14,2014,2015,1,Mid Op-Ex,21.0
94,20700,"East Stroudsburg, PA Metro Area",2017,168046,9/1/15,2015,2016,1,,
95,20740,"Eau Claire, WI Metro Area",2017,167484,3/1/17,2017,2018,0,Low Op-Ex,22.0
96,20940,"El Centro, CA Metro Area",2017,182830,7/1/16,2016,2017,1,Low Op-Ex,22.0
98,21140,"Elkhart-Goshen, IN Metro Area",2017,205032,8/1/16,2016,2017,1,Low Op-Ex,22.0
99,21300,"Elmira, NY Metro Area",2017,85557,7/1/17,2017,2018,0,Low Op-Ex,22.0
100,31140,"Louisville-Jefferson County, KY-IN Metro Area",2017,1293722,4/1/14,2014,2015,1,Mid Op-Ex,21.0
101,21500,"Erie, PA Metro Area",2017,274541,4/1/15,2015,2016,1,Low Op-Ex,22.0
102,35380,"New Orleans-Metairie, LA Metro Area",2017,1275762,9/1/14,2014,2015,1,Mid Op-Ex,21.0
103,21780,"Evansville, IN-KY Metro Area",2017,315669,1/1/17,2017,2018,0,Low Op-Ex,22.0
104,21820,"Fairbanks, AK Metro Area",2017,99703,7/1/17,2017,2018,0,Low Op-Ex,22.0
105,22020,"Fargo, ND-MN Metro Area",2017,241356,5/1/15,2015,2016,1,Low Op-Ex,22.0
106,22180,"Fayetteville, NC Metro Area",2017,386662,10/1/14,2014,2015,1,Low Op-Ex,22.0
107,22220,"Fayetteville-Springdale-Rogers, AR-MO Metro Area",2017,535557,11/1/14,2014,2015,1,Low Op-Ex,22.0
108,22380,"Flagstaff, AZ Metro Area",2017,140776,1/1/15,2015,2016,1,Low Op-Ex,22.0
109,22420,"Flint, MI Metro Area",2017,407385,5/1/15,2015,2016,1,Low Op-Ex,22.0
112,22660,"Fort Collins, CO Metro Area",2017,343976,8/1/14,2014,2015,1,Low Op-Ex,22.0
113,22900,"Fort Smith, AR-OK Metro Area",2017,282086,5/1/16,2016,2017,1,Low Op-Ex,22.0
114,23020,"Crestview-Fort Walton Beach-Destin, FL Metro Area",2017,271346,5/1/15,2015,2016,1,Low Op-Ex,22.0
115,23060,"Fort Wayne, IN Metro Area",2017,434617,5/1/15,2015,2016,1,Low Op-Ex,22.0
116,25540,"Hartford-West Hartford-East Hartford, CT Metro Area",2017,1210259,7/1/14,2014,2015,1,Mid Op-Ex,21.0
117,23540,"Gainesville, FL Metro Area",2017,285374,9/1/14,2014,2015,1,Low Op-Ex,22.0
118,23580,"Gainesville, GA Metro Area",2017,199335,12/1/15,2015,2016,1,Low Op-Ex,22.0
119,23900,"Gettysburg, PA Metro Area",2017,102336,1/1/17,2017,2018,0,,
120,24020,"Glens Falls, NY Metro Area",2017,126152,7/1/17,2017,2018,0,Low Op-Ex,22.0
121,24140,"Goldsboro, NC Metro Area",2017,124172,1/1/17,2017,2018,0,Low Op-Ex,22.0
122,24220,"Grand Forks, ND-MN Metro Area",2017,102414,3/1/17,2017,2018,0,Low Op-Ex,22.0
123,24300,"Grand Junction, CO Metro Area",2017,151616,3/1/16,2016,2017,1,Low Op-Ex,22.0
124,41620,"Salt Lake City, UT Metro Area",2017,1203105,5/1/14,2014,2015,1,Mid Op-Ex,21.0
125,24500,"Great Falls, MT Metro Area",2017,81654,11/1/17,2017,2018,0,Low Op-Ex,22.0
126,24540,"Greeley, CO Metro Area",2017,304633,4/1/16,2016,2017,1,Low Op-Ex,22.0
127,24580,"Green Bay, WI Metro Area",2017,320050,3/1/15,2015,2016,1,Low Op-Ex,22.0
128,24660,"Greensboro-High Point, NC Metro Area",2017,761184,7/1/14,2014,2015,1,Low Op-Ex,22.0
129,24780,"Greenville, NC Metro Area",2017,179042,9/1/15,2015,2016,1,Low Op-Ex,22.0
130,24860,"Greenville-Anderson-Mauldin, SC Metro Area",2017,895923,7/1/14,2014,2015,1,Low Op-Ex,22.0
131,25060,"Gulfport-Biloxi-Pascagoula, MS Metro Area",2017,394232,7/1/16,2016,2017,1,Low Op-Ex,22.0
132,25180,"Hagerstown-Martinsburg, MD-WV Metro Area",2017,265498,10/1/15,2015,2016,1,Low Op-Ex,22.0
133,25220,"Hammond, LA Metro Area",2017,132497,5/1/17,2017,2018,0,,
134,25260,"Hanford-Corcoran, CA Metro Area",2017,150101,10/1/16,2016,2017,1,Low Op-Ex,22.0
135,13820,"Birmingham-Hoover, AL Metro Area",2017,1149807,12/1/15,2015,2016,1,Mid Op-Ex,21.0
136,25500,"Harrisonburg, VA Metro Area",2017,134442,10/1/15,2015,2016,1,Low Op-Ex,22.0
137,15380,"Buffalo-Cheektowaga-Niagara Falls, NY Metro Area",2017,1136856,6/1/17,2017,2018,0,Mid Op-Ex,21.0
138,25620,"Hattiesburg, MS Metro Area",2017,146530,7/1/16,2016,2017,1,Low Op-Ex,22.0
139,25860,"Hickory-Lenoir-Morganton, NC Metro Area",2017,366534,2/1/17,2017,2018,0,Low Op-Ex,22.0
140,25940,"Hilton Head Island-Bluffton-Beaufort, SC Metro Area",2017,215302,4/1/15,2015,2016,1,,
141,25980,"Hinesville, GA Metro Area",2017,81044,6/1/16,2016,2017,1,Low Op-Ex,22.0
142,26140,"Homosassa Springs, FL Metro Area",2017,145647,10/1/17,2017,2018,0,,
143,26300,"Hot Springs, AR Metro Area",2017,98658,1/1/17,2017,2018,0,Low Op-Ex,22.0
144,26420,"Houston-The Woodlands-Sugar Land, TX Metro Area",2017,6892427,2/1/14,2014,2015,1,High Op-Ex,20.0
145,26580,"Huntington-Ashland, WV-KY-OH Metro Area",2017,356474,8/1/16,2016,2017,1,Low Op-Ex,22.0
146,26620,"Huntsville, AL Metro Area",2017,455448,3/1/16,2016,2017,1,Low Op-Ex,22.0
147,26820,"Idaho Falls, ID Metro Area",2017,145349,1/1/17,2017,2018,0,Low Op-Ex,22.0
148,40380,"Rochester, NY Metro Area",2017,1077948,6/1/17,2017,2018,0,Mid Op-Ex,21.0
149,26980,"Iowa City, IA Metro Area",2017,171491,4/1/16,2016,2017,1,Low Op-Ex,22.0
150,27060,"Ithaca, NY Metro Area",2017,104802,7/1/17,2017,2018,0,Low Op-Ex,22.0
152,27140,"Jackson, MS Metro Area",2017,578794,12/1/14,2014,2015,1,Low Op-Ex,22.0
154,24340,"Grand Rapids-Wyoming, MI Metro Area",2017,1059113,8/1/14,2014,2015,1,Mid Op-Ex,21.0
155,27340,"Jacksonville, NC Metro Area",2017,193893,10/1/15,2015,2016,1,Low Op-Ex,22.0
156,27500,"Janesville-Beloit, WI Metro Area",2017,162309,12/1/16,2016,2017,1,Low Op-Ex,22.0
157,27620,"Jefferson City, MO Metro Area",2017,147584,5/1/17,2017,2018,0,Low Op-Ex,22.0
158,27740,"Johnson City, TN Metro Area",2017,203462,8/1/16,2016,2017,1,Low Op-Ex,22.0
159,27780,"Johnstown, PA Metro Area",2017,133054,11/1/17,2017,2018,0,Low Op-Ex,22.0
160,27860,"Jonesboro, AR Metro Area",2017,131269,8/1/17,2017,2018,0,Low Op-Ex,22.0
161,27900,"Joplin, MO Metro Area",2017,178507,5/1/17,2017,2018,0,Low Op-Ex,22.0
162,27980,"Kahului-Wailuku-Lahaina, HI Metro Area",2017,166348,1/1/15,2015,2016,1,,
163,28020,"Kalamazoo-Portage, MI Metro Area",2017,338338,10/1/14,2014,2015,1,Low Op-Ex,22.0
164,28100,"Kankakee, IL Metro Area",2017,109605,7/1/17,2017,2018,0,Low Op-Ex,22.0
165,46060,"Tucson, AZ Metro Area",2017,1022769,10/1/13,2013,2014,1,Mid Op-Ex,21.0
166,23420,"Fresno, CA Metro Area",2017,989255,2/1/14,2014,2015,1,Mid Op-Ex,21.0
167,28660,"Killeen-Temple, TX Metro Area",2017,442693,7/1/15,2015,2016,1,Low Op-Ex,22.0
168,28700,"Kingsport-Bristol-Bristol, TN-VA Metro Area",2017,305914,9/1/16,2016,2017,1,Low Op-Ex,22.0
169,28740,"Kingston, NY Metro Area",2017,179417,7/1/17,2017,2018,0,Low Op-Ex,22.0
170,28940,"Knoxville, TN Metro Area",2017,877874,8/1/14,2014,2015,1,Low Op-Ex,22.0
172,29100,"La Crosse-Onalaska, WI-MN Metro Area",2017,136934,3/1/17,2017,2018,0,Low Op-Ex,22.0
173,29140,"Lafayette-West Lafayette, IN Metro Area",2017,218769,7/1/15,2015,2016,1,Low Op-Ex,22.0
174,29180,"Lafayette, LA Metro Area",2017,491558,2/1/15,2015,2016,1,Low Op-Ex,22.0
175,29420,"Lake Havasu City-Kingman, AZ Metro Area",2017,207200,3/1/16,2016,2017,1,,
176,29460,"Lakeland-Winter Haven, FL Metro Area",2017,686483,3/1/15,2015,2016,1,Low Op-Ex,22.0
177,46520,"Urban Honolulu, HI Metro Area",2017,988650,8/1/13,2013,2014,1,Mid Op-Ex,21.0
178,14860,"Bridgeport-Stamford-Norwalk, CT Metro Area",2017,949921,4/1/14,2014,2015,1,Mid Op-Ex,21.0
179,29700,"Laredo, TX Metro Area",2017,274794,7/1/17,2017,2018,0,Low Op-Ex,22.0
180,29740,"Las Cruces, NM Metro Area",2017,215579,9/1/15,2015,2016,1,Low Op-Ex,22.0
181,49340,"Worcester, MA-CT Metro Area",2017,942475,8/1/14,2014,2015,1,Mid Op-Ex,21.0
182,29940,"Lawrence, KS Metro Area",2017,120793,6/1/15,2015,2016,1,Low Op-Ex,22.0
183,30020,"Lawton, OK Metro Area",2017,127735,3/1/17,2017,2018,0,Low Op-Ex,22.0
184,30140,"Lebanon, PA Metro Area",2017,139754,6/1/16,2016,2017,1,Low Op-Ex,22.0
185,30340,"Lewiston-Auburn, ME Metro Area",2017,107651,9/1/17,2017,2018,0,Low Op-Ex,22.0
186,30460,"Lexington-Fayette, KY Metro Area",2017,512650,7/1/14,2014,2015,1,Low Op-Ex,22.0
187,30700,"Lincoln, NE Metro Area",2017,331592,1/1/15,2015,2016,1,Low Op-Ex,22.0
188,30780,"Little Rock-North Little Rock-Conway, AR Metro Area",2017,738082,11/1/14,2014,2015,1,Low Op-Ex,22.0
190,30980,"Longview, TX Metro Area",2017,217481,11/1/17,2017,2018,0,Low Op-Ex,22.0
191,31100,"Los Angeles-Long Beach-Anaheim, CA Metro Area",2017,13353907,2/1/12,2012,2013,1,High Op-Ex,8.0
192,10740,"Albuquerque, NM Metro Area",2017,913113,5/1/14,2014,2015,1,Mid Op-Ex,21.0
193,31180,"Lubbock, TX Metro Area",2017,318011,7/1/14,2014,2015,1,Low Op-Ex,22.0
194,31340,"Lynchburg, VA Metro Area",2017,260116,12/1/15,2015,2016,1,Low Op-Ex,22.0
195,31420,"Macon-Bibb County, GA Metro Area",2017,229258,5/1/16,2016,2017,1,Low Op-Ex,22.0
197,10580,"Albany-Schenectady-Troy, NY Metro Area",2017,886188,6/1/17,2017,2018,0,Mid Op-Ex,21.0
198,31700,"Manchester-Nashua, NH Metro Area",2017,409697,10/1/14,2014,2015,1,Low Op-Ex,22.0
199,31740,"Manhattan, KS Metro Area",2017,98080,6/1/15,2015,2016,1,Low Op-Ex,22.0
200,31860,"Mankato-North Mankato, MN Metro Area",2017,100939,3/1/17,2017,2018,0,Low Op-Ex,22.0
201,32580,"McAllen-Edinburg-Mission, TX Metro Area",2017,860661,7/1/17,2017,2018,0,Low Op-Ex,22.0
202,32780,"Medford, OR Metro Area",2017,217479,12/1/17,2017,2018,0,Low Op-Ex,22.0
203,35300,"New Haven-Milford, CT Metro Area",2017,860435,5/1/14,2014,2015,1,Mid Op-Ex,21.0
204,32900,"Merced, CA Metro Area",2017,272673,11/1/15,2015,2016,1,Low Op-Ex,22.0
205,33100,"Miami-Fort Lauderdale-West Palm Beach, FL Metro Area",2017,6158824,6/1/14,2014,2015,1,High Op-Ex,9.0
206,33140,"Michigan City-La Porte, IN Metro Area",2017,110029,5/1/16,2016,2017,1,Low Op-Ex,22.0
208,33260,"Midland, TX Metro Area",2017,169643,6/1/16,2016,2017,1,Low Op-Ex,22.0
209,37100,"Oxnard-Thousand Oaks-Ventura, CA Metro Area",2017,854223,5/1/14,2014,2015,1,Mid Op-Ex,21.0
210,33460,"Minneapolis-St. Paul-Bloomington, MN-WI Metro Area",2017,3600618,10/1/12,2012,2013,1,High Op-Ex,18.0
211,33540,"Missoula, MT Metro Area",2017,117441,8/1/16,2016,2017,1,Low Op-Ex,22.0
212,33660,"Mobile, AL Metro Area",2017,413955,6/1/15,2015,2016,1,Low Op-Ex,22.0
213,33700,"Modesto, CA Metro Area",2017,547899,5/1/14,2014,2015,1,Low Op-Ex,22.0
214,33740,"Monroe, LA Metro Area",2017,178445,9/1/17,2017,2018,0,Low Op-Ex,22.0
215,33860,"Montgomery, AL Metro Area",2017,373889,2/1/16,2016,2017,1,Low Op-Ex,22.0
216,34060,"Morgantown, WV Metro Area",2017,138709,7/1/16,2016,2017,1,Low Op-Ex,22.0
218,34620,"Muncie, IN Metro Area",2017,115184,9/1/16,2016,2017,1,Low Op-Ex,22.0
220,34820,"Myrtle Beach-Conway-North Myrtle Beach, SC-NC Metro Area",2017,464165,8/1/14,2014,2015,1,Low Op-Ex,22.0
221,34900,"Napa, CA Metro Area",2017,140973,4/1/14,2014,2015,1,Low Op-Ex,22.0
222,34940,"Naples-Immokalee-Marco Island, FL Metro Area",2017,372880,12/1/14,2014,2015,1,Low Op-Ex,22.0
223,21340,"El Paso, TX Metro Area",2017,842677,7/1/14,2014,2015,1,Mid Op-Ex,21.0
224,35100,"New Bern, NC Metro Area",2017,125786,3/1/16,2016,2017,1,,
225,10900,"Allentown-Bethlehem-Easton, PA-NJ Metro Area",2017,840550,2/1/15,2015,2016,1,Mid Op-Ex,21.0
226,35840,"North Port-Sarasota-Bradenton, FL Metro Area",2017,804690,12/1/14,2014,2015,1,Mid Op-Ex,21.0
227,35620,"New York-Newark-Jersey City, NY-NJ-PA Metro Area",2017,20320876,5/1/11,2011,2012,1,New York,1.0
229,19380,"Dayton, OH Metro Area",2017,803416,10/1/14,2014,2015,1,Mid Op-Ex,21.0
230,35980,"Norwich-New London, CT Metro Area",2017,269033,2/1/15,2015,2016,1,Low Op-Ex,22.0
231,36100,"Ocala, FL Metro Area",2017,354353,9/1/15,2015,2016,1,Low Op-Ex,22.0
232,36140,"Ocean City, NJ Metro Area",2017,93553,5/1/15,2015,2016,1,Low Op-Ex,22.0
233,36220,"Odessa, TX Metro Area",2017,157087,10/1/15,2015,2016,1,Low Op-Ex,22.0
234,44700,"Stockton-Lodi, CA Metro Area",2017,745424,9/1/14,2014,2015,1,Mid Op-Ex,21.0
235,10420,"Akron, OH Metro Area",2017,703505,12/1/14,2014,2015,1,Mid Op-Ex,21.0
236,36260,"Ogden-Clearfield, UT Metro Area",2017,666547,3/1/15,2015,2016,1,Mid Op-Ex,21.0
237,36540,"Omaha-Council Bluffs, NE-IA Metro Area",2017,934184,6/1/14,2014,2015,1,Low Op-Ex,22.0
238,45060,"Syracuse, NY Metro Area",2017,654841,6/1/17,2017,2018,0,Mid Op-Ex,21.0
239,36780,"Oshkosh-Neenah, WI Metro Area",2017,170414,11/1/15,2015,2016,1,Low Op-Ex,22.0
240,31540,"Madison, WI Metro Area",2017,654230,3/1/14,2014,2015,1,Mid Op-Ex,21.0
241,37340,"Palm Bay-Melbourne-Titusville, FL Metro Area",2017,589162,12/1/14,2014,2015,1,Low Op-Ex,22.0
242,37460,"Panama City, FL Metro Area",2017,202236,3/1/17,2017,2018,0,Low Op-Ex,22.0
244,37860,"Pensacola-Ferry Pass-Brent, FL Metro Area",2017,487784,1/1/15,2015,2016,1,Low Op-Ex,22.0
245,37900,"Peoria, IL Metro Area",2017,373637,11/1/15,2015,2016,1,Low Op-Ex,22.0
246,37980,"Philadelphia-Camden-Wilmington, PA-NJ-DE-MD Metro Area",2017,6096120,5/1/12,2012,2013,1,High Op-Ex,7.0
247,38060,"Phoenix-Mesa-Scottsdale, AZ Metro Area",2017,4737270,11/1/12,2012,2013,1,High Op-Ex,16.0
248,38300,"Pittsburgh, PA Metro Area",2017,2333367,2/1/14,2014,2015,1,High Op-Ex,13.0
249,38340,"Pittsfield, MA Metro Area",2017,126313,6/1/17,2017,2018,0,Low Op-Ex,22.0
250,38540,"Pocatello, ID Metro Area",2017,85269,10/1/17,2017,2018,0,,
251,19660,"Deltona-Daytona Beach-Ormond Beach, FL Metro Area",2017,649202,12/1/14,2014,2015,1,Mid Op-Ex,21.0
252,38900,"Portland-Vancouver-Hillsboro, OR-WA Metro Area",2017,2451560,8/1/14,2014,2015,1,High Op-Ex,12.0
253,38940,"Port St. Lucie, FL Metro Area",2017,473429,3/1/15,2015,2016,1,Low Op-Ex,22.0
254,39140,"Prescott, AZ Metro Area",2017,228168,4/1/16,2016,2017,1,,
255,44140,"Springfield, MA Metro Area",2017,631652,1/1/15,2015,2016,1,Mid Op-Ex,21.0
256,39340,"Provo-Orem, UT Metro Area",2017,617678,4/1/15,2015,2016,1,Mid Op-Ex,21.0
257,39380,"Pueblo, CO Metro Area",2017,166475,9/1/16,2016,2017,1,Low Op-Ex,22.0
258,39460,"Punta Gorda, FL Metro Area",2017,182033,10/1/15,2015,2016,1,Low Op-Ex,22.0
259,39540,"Racine, WI Metro Area",2017,196071,11/1/15,2015,2016,1,Low Op-Ex,22.0
260,25420,"Harrisburg-Carlisle, PA Metro Area",2017,571903,2/1/15,2015,2016,1,Mid Op-Ex,21.0
261,39740,"Reading, PA Metro Area",2017,417854,5/1/15,2015,2016,1,Low Op-Ex,22.0
262,39820,"Redding, CA Metro Area",2017,179921,3/1/16,2016,2017,1,Low Op-Ex,22.0
263,20500,"Durham-Chapel Hill, NC Metro Area",2017,567428,6/1/14,2014,2015,1,Mid Op-Ex,21.0
264,44060,"Spokane-Spokane Valley, WA Metro Area",2017,564291,6/1/14,2014,2015,1,Mid Op-Ex,21.0
265,29540,"Lancaster, PA Metro Area",2017,542903,4/1/15,2015,2016,1,Mid Op-Ex,21.0
266,40220,"Roanoke, VA Metro Area",2017,312688,11/1/14,2014,2015,1,Low Op-Ex,22.0
267,40340,"Rochester, MN Metro Area",2017,218280,3/1/17,2017,2018,0,Low Op-Ex,22.0
268,38860,"Portland-South Portland, ME Metro Area",2017,532083,10/1/14,2014,2015,1,Mid Op-Ex,21.0
269,40420,"Rockford, IL Metro Area",2017,338291,3/1/15,2015,2016,1,Low Op-Ex,22.0
272,29620,"Lansing-East Lansing, MI Metro Area",2017,477656,8/1/14,2014,2015,1,Mid Op-Ex,21.0
273,40980,"Saginaw, MI Metro Area",2017,191934,3/1/17,2017,2018,0,Low Op-Ex,22.0
274,41060,"St. Cloud, MN Metro Area",2017,197759,3/1/17,2017,2018,0,Low Op-Ex,22.0
275,41100,"St. George, UT Metro Area",2017,165662,7/1/16,2016,2017,1,Low Op-Ex,22.0
276,41140,"St. Joseph, MO-KS Metro Area",2017,127092,9/1/17,2017,2018,0,Low Op-Ex,22.0
277,39900,"Reno, NV Metro Area",2017,465208,9/1/15,2015,2016,1,Mid Op-Ex,21.0
278,18580,"Corpus Christi, TX Metro Area",2017,449830,6/1/17,2017,2018,0,Mid Op-Ex,21.0
279,42060,"Santa Maria-Santa Barbara, CA Metro Area",2017,448150,10/1/13,2013,2014,1,Mid Op-Ex,21.0
280,41540,"Salisbury, MD-DE Metro Area",2017,405853,5/1/15,2015,2016,1,Low Op-Ex,22.0
281,41500,"Salinas, CA Metro Area",2017,437907,8/1/14,2014,2015,1,Mid Op-Ex,21.0
282,41660,"San Angelo, TX Metro Area",2017,119317,8/1/17,2017,2018,0,Low Op-Ex,22.0
283,41420,"Salem, OR Metro Area",2017,424982,6/1/17,2017,2018,0,Mid Op-Ex,21.0
284,41740,"San Diego-Carlsbad, CA Metro Area",2017,3337685,5/1/12,2012,2013,1,High Op-Ex,10.0
285,41860,"San Francisco-Oakland-Hayward, CA Metro Area",2017,4727357,10/1/10,2010,2011,1,High Op-Ex,2.0
286,41940,"San Jose-Sunnyvale-Santa Clara, CA Metro Area",2017,1998463,5/1/12,2012,2013,1,High Op-Ex,6.0
287,42020,"San Luis Obispo-Paso Robles-Arroyo Grande, CA Metro Area",2017,283405,7/1/14,2014,2015,1,Low Op-Ex,22.0
288,11260,"Anchorage, AK Metro Area",2017,400888,6/1/17,2017,2018,0,Mid Op-Ex,21.0
290,42140,"Santa Fe, NM Metro Area",2017,148750,3/1/15,2015,2016,1,Low Op-Ex,22.0
291,42220,"Santa Rosa, CA Metro Area",2017,504217,5/1/14,2014,2015,1,Low Op-Ex,22.0
292,42340,"Savannah, GA Metro Area",2017,387543,5/1/15,2015,2016,1,Low Op-Ex,22.0
293,42540,"Scranton-Wilkes-Barre-Hazleton, PA Metro Area",2017,555426,2/1/15,2015,2016,1,Low Op-Ex,22.0
294,42660,"Seattle-Tacoma-Bellevue, WA Metro Area",2017,3867046,8/1/11,2011,2012,1,High Op-Ex,11.0
295,42680,"Sebastian-Vero Beach, FL Metro Area",2017,154383,8/1/15,2015,2016,1,Low Op-Ex,22.0
297,43100,"Sheboygan, WI Metro Area",2017,115344,5/1/17,2017,2018,0,Low Op-Ex,22.0
301,43580,"Sioux City, IA-NE-SD Metro Area",2017,169131,4/1/17,2017,2018,0,Low Op-Ex,22.0
302,43780,"South Bend-Mishawaka, IN-MI Metro Area",2017,321815,10/1/14,2014,2015,1,Low Op-Ex,22.0
303,43900,"Spartanburg, SC Metro Area",2017,334391,7/1/15,2015,2016,1,Low Op-Ex,22.0
304,45940,"Trenton, NJ Metro Area",2017,374733,5/1/14,2014,2015,1,Mid Op-Ex,21.0
305,44100,"Springfield, IL Metro Area",2017,207596,2/1/15,2015,2016,1,Low Op-Ex,22.0
306,11460,"Ann Arbor, MI Metro Area",2017,367627,4/1/14,2014,2015,1,Mid Op-Ex,21.0
307,44180,"Springfield, MO Metro Area",2017,461469,11/1/16,2016,2017,1,Low Op-Ex,22.0
308,44220,"Springfield, OH Metro Area",2017,134557,2/1/17,2017,2018,0,Low Op-Ex,22.0
309,44300,"State College, PA Metro Area",2017,162660,2/1/15,2015,2016,1,Low Op-Ex,22.0
311,14500,"Boulder, CO Metro Area",2017,322514,2/1/14,2014,2015,1,Mid Op-Ex,21.0
313,28420,"Kennewick-Richland, WA Metro Area",2017,290296,12/1/16,2016,2017,1,Mid Op-Ex,21.0
314,45220,"Tallahassee, FL Metro Area",2017,385473,9/1/14,2014,2015,1,Low Op-Ex,22.0
315,36500,"Olympia-Tumwater, WA Metro Area",2017,280588,6/1/15,2015,2016,1,Mid Op-Ex,21.0
316,45460,"Terre Haute, IN Metro Area",2017,165798,3/1/17,2017,2018,0,Low Op-Ex,22.0
318,45540,"The Villages, FL Metro Area",2017,125165,12/1/17,2017,2018,0,,
319,45780,"Toledo, OH Metro Area",2017,603668,11/1/14,2014,2015,1,Low Op-Ex,22.0
320,45820,"Topeka, KS Metro Area",2017,233149,11/1/15,2015,2016,1,Low Op-Ex,22.0
